{
  "$schema": "https://json-schema.org/draft/2020-12/schema",
  "$id": "https://sierracatalina.com/context-layer/primitives/approval-handle.schema.json",
  "title": "approval handle",
  "description": "Companion to a policy_decision of needs_approval. Successful protocol output, not an error. MUST NOT carry claim values or denied vault content.",
  "type": "object",
  "additionalProperties": false,
  "required": [
    "spec_version",
    "type",
    "id",
    "created_at",
    "issuer",
    "request_ref",
    "pass_gap",
    "expires_at"
  ],
  "properties": {
    "spec_version": {
      "const": "context-layer/0.3-draft"
    },
    "type": {
      "const": "approval_handle"
    },
    "id": {
      "type": "string",
      "pattern": "^urn:cl:approval:[A-Za-z0-9._~-]+$"
    },
    "created_at": {
      "type": "string",
      "format": "date-time"
    },
    "issuer": {
      "$ref": "#/$defs/issuer"
    },
    "request_ref": {
      "type": "string",
      "pattern": "^urn:cl:request:[A-Za-z0-9._~-]+$"
    },
    "decision_ref": {
      "type": "string",
      "pattern": "^urn:cl:decision:[A-Za-z0-9._~-]+$"
    },
    "pass_gap": {
      "type": "object",
      "additionalProperties": false,
      "required": [
        "missing_categories"
      ],
      "properties": {
        "missing_categories": {
          "type": "array",
          "minItems": 1,
          "maxItems": 4,
          "uniqueItems": true,
          "items": {
            "$ref": "#/$defs/memory_category"
          }
        }
      }
    },
    "user_visible_url": {
      "type": "string",
      "minLength": 8,
      "maxLength": 2048,
      "pattern": "^https://"
    },
    "expires_at": {
      "type": "string",
      "format": "date-time"
    }
  },
  "$defs": {
    "issuer": {
      "type": "object",
      "additionalProperties": false,
      "required": [
        "id"
      ],
      "properties": {
        "id": {
          "type": "string",
          "minLength": 3,
          "maxLength": 512
        }
      }
    },
    "memory_category": {
      "enum": [
        "preference",
        "fact",
        "project",
        "instruction"
      ]
    }
  }
}
